{
  "$schema": "https://json-schema.org/draft/2020-12/schema",
  "$id": "https://deeptempo.ai/vigil/enforcement/contracts/vector/v1",
  "title": "Enforcement contract vector v1",
  "description": "An ordered list of HTTP steps against the enforcement API and the outcome each must produce. The Go contract test executes every vector against the real handlers on a fresh FakeKernel; a vector or schema that looks wrong is a contract change, made in its own PR (medic convention).",
  "type": "object",
  "required": ["id", "description", "steps"],
  "additionalProperties": false,
  "properties": {
    "id": { "type": "string", "pattern": "^v[0-9]{2,3}-[a-z0-9-]+$" },
    "description": { "type": "string", "minLength": 1 },
    "kernel": {
      "description": "Optional FakeKernel overrides for this vector (capability probes). A missing entry means the primitive is supported.",
      "type": "object",
      "additionalProperties": false,
      "properties": {
        "unsupported_kinds": {
          "description": "Kinds whose capability probe reports unsupported.",
          "type": "array",
          "items": { "enum": ["xdp_drop", "socket_redirect", "process_interdict"] }
        }
      }
    },
    "steps": {
      "type": "array",
      "minItems": 1,
      "items": {
        "type": "object",
        "required": ["name", "request", "expect"],
        "additionalProperties": false,
        "properties": {
          "name": { "type": "string" },
          "request": {
            "type": "object",
            "required": ["method", "path"],
            "additionalProperties": false,
            "properties": {
              "method": { "enum": ["POST", "GET", "DELETE"] },
              "path": { "type": "string" },
              "body": { "description": "JSON request body (POST).", "type": "object" },
              "auth": { "description": "Defaults to true; a false step exercises the unauthenticated rejection path.", "type": "boolean" }
            }
          },
          "expect": {
            "type": "object",
            "required": ["status"],
            "additionalProperties": false,
            "properties": {
              "status": { "type": "integer" },
              "state": { "description": "Expected response 'state' when the step succeeds.", "enum": ["enforced", "released"] },
              "error": { "description": "Expected error code on an error reply.", "type": "string" },
              "error_reason": { "description": "Expected details.reason for invalid_target refusals.", "type": "string" },
              "replayed": { "description": "Expected 'replayed' flag on success replies.", "type": "boolean" },
              "evidence_echoes_action_id": { "description": "Assert the reply's action_id equals the request's.", "type": "boolean" }
            }
          }
        }
      }
    }
  }
}
